{
  "manifest_version": "1.0.0",
  "session_id": "5e551011-0000-4000-8000-000000000001",
  "job_id": "10b00000-0000-4000-8000-000000000002",
  "started_at": "2026-05-28T14:32:00.000Z",
  "ended_at": "2026-05-28T14:33:30.000Z",
  "device_info": {
    "model": "iPhone 15 Pro",
    "model_identifier": "iPhone16,1",
    "os_version": "17.5.1",
    "app_version": "1.0.0"
  },
  "gps_origin": {
    "latitude": 40.808,
    "longitude": -96.706,
    "altitude_m": 360.0,
    "horizontal_accuracy_m": 3.5,
    "vertical_accuracy_m": 5.0,
    "timestamp": "2026-05-28T14:32:00.000Z"
  },
  "captures": [
    {
      "capture_index": 0,
      "prompt_label": "front_left_corner",
      "photo_filename": "photo_00.jpg",
      "depth_filename": "depth_00.png",
      "timestamp": "2026-05-28T14:32:10.000Z",
      "gps": {
        "latitude": 40.8079965,
        "longitude": -96.7060035,
        "altitude_m": 359.825,
        "horizontal_accuracy_m": 4.0,
        "vertical_accuracy_m": 6.0
      },
      "camera_pose": {
        "intrinsics_row_major": [
          80.0,
          0.0,
          50.0,
          0.0,
          80.0,
          50.0,
          0.0,
          0.0,
          1.0
        ],
        "world_to_camera_row_major": [
          1.0,
          0.0,
          0.0,
          13.0,
          0.0,
          1.0,
          0.0,
          1.6,
          -0.0,
          0.0,
          1.0,
          4.0,
          0.0,
          0.0,
          0.0,
          1.0
        ]
      },
      "attitude": {
        "quaternion_w": 1.0,
        "quaternion_x": 0.0,
        "quaternion_y": 0.0,
        "quaternion_z": 0.0,
        "reference_frame": "xArbitraryZVertical"
      },
      "depth_scale": 1000.0,
      "depth_unit": "mm_as_uint16",
      "depth_range_m": [
        2.0,
        2.0
      ]
    },
    {
      "capture_index": 1,
      "prompt_label": "front_facade",
      "photo_filename": "photo_01.jpg",
      "depth_filename": "depth_01.png",
      "timestamp": "2026-05-28T14:32:11.000Z",
      "gps": {
        "latitude": 40.8079975,
        "longitude": -96.7060025,
        "altitude_m": 359.875,
        "horizontal_accuracy_m": 4.0,
        "vertical_accuracy_m": 6.0
      },
      "camera_pose": {
        "intrinsics_row_major": [
          80.0,
          0.0,
          50.0,
          0.0,
          80.0,
          50.0,
          0.0,
          0.0,
          1.0
        ],
        "world_to_camera_row_major": [
          0.7071067811865476,
          0.0,
          0.7071067811865475,
          10.65685424949238,
          0.0,
          1.0,
          0.0,
          1.6,
          -0.7071067811865475,
          0.0,
          0.7071067811865476,
          9.65685424949238,
          0.0,
          0.0,
          0.0,
          1.0
        ]
      },
      "attitude": {
        "quaternion_w": 0.92387953,
        "quaternion_x": 0.0,
        "quaternion_y": 0.38268343,
        "quaternion_z": 0.0,
        "reference_frame": "xArbitraryZVertical"
      },
      "depth_scale": 1000.0,
      "depth_unit": "mm_as_uint16",
      "depth_range_m": [
        2.0,
        2.0
      ]
    },
    {
      "capture_index": 2,
      "prompt_label": "front_right_corner",
      "photo_filename": "photo_02.jpg",
      "depth_filename": "depth_02.png",
      "timestamp": "2026-05-28T14:32:12.000Z",
      "gps": {
        "latitude": 40.8079985,
        "longitude": -96.7060015,
        "altitude_m": 359.925,
        "horizontal_accuracy_m": 4.0,
        "vertical_accuracy_m": 6.0
      },
      "camera_pose": {
        "intrinsics_row_major": [
          80.0,
          0.0,
          50.0,
          0.0,
          80.0,
          50.0,
          0.0,
          0.0,
          1.0
        ],
        "world_to_camera_row_major": [
          6.123233995736766e-17,
          0.0,
          1.0,
          5.000000000000001,
          0.0,
          1.0,
          0.0,
          1.6,
          -1.0,
          0.0,
          6.123233995736766e-17,
          12.0,
          0.0,
          0.0,
          0.0,
          1.0
        ]
      },
      "attitude": {
        "quaternion_w": 0.70710678,
        "quaternion_x": 0.0,
        "quaternion_y": 0.70710678,
        "quaternion_z": 0.0,
        "reference_frame": "xArbitraryZVertical"
      },
      "depth_scale": 1000.0,
      "depth_unit": "mm_as_uint16",
      "depth_range_m": [
        2.0,
        2.0
      ]
    },
    {
      "capture_index": 3,
      "prompt_label": "right_facade",
      "photo_filename": "photo_03.jpg",
      "depth_filename": "depth_03.png",
      "timestamp": "2026-05-28T14:32:13.000Z",
      "gps": {
        "latitude": 40.8079995,
        "longitude": -96.7060005,
        "altitude_m": 359.975,
        "horizontal_accuracy_m": 4.0,
        "vertical_accuracy_m": 6.0
      },
      "camera_pose": {
        "intrinsics_row_major": [
          80.0,
          0.0,
          50.0,
          0.0,
          80.0,
          50.0,
          0.0,
          0.0,
          1.0
        ],
        "world_to_camera_row_major": [
          -0.7071067811865475,
          0.0,
          0.7071067811865476,
          -0.6568542494923797,
          0.0,
          1.0,
          0.0,
          1.6,
          -0.7071067811865476,
          0.0,
          -0.7071067811865475,
          9.65685424949238,
          0.0,
          0.0,
          0.0,
          1.0
        ]
      },
      "attitude": {
        "quaternion_w": 0.38268343,
        "quaternion_x": 0.0,
        "quaternion_y": 0.92387953,
        "quaternion_z": 0.0,
        "reference_frame": "xArbitraryZVertical"
      },
      "depth_scale": 1000.0,
      "depth_unit": "mm_as_uint16",
      "depth_range_m": [
        2.0,
        2.0
      ]
    },
    {
      "capture_index": 4,
      "prompt_label": "back_right_corner",
      "photo_filename": "photo_04.jpg",
      "depth_filename": "depth_04.png",
      "timestamp": "2026-05-28T14:32:14.000Z",
      "gps": {
        "latitude": 40.8080005,
        "longitude": -96.7059995,
        "altitude_m": 360.025,
        "horizontal_accuracy_m": 4.0,
        "vertical_accuracy_m": 6.0
      },
      "camera_pose": {
        "intrinsics_row_major": [
          80.0,
          0.0,
          50.0,
          0.0,
          80.0,
          50.0,
          0.0,
          0.0,
          1.0
        ],
        "world_to_camera_row_major": [
          -1.0,
          0.0,
          1.2246467991473532e-16,
          -3.0,
          0.0,
          1.0,
          0.0,
          1.6,
          -1.2246467991473532e-16,
          0.0,
          -1.0,
          4.000000000000001,
          0.0,
          0.0,
          0.0,
          1.0
        ]
      },
      "attitude": {
        "quaternion_w": 0.0,
        "quaternion_x": 0.0,
        "quaternion_y": 1.0,
        "quaternion_z": 0.0,
        "reference_frame": "xArbitraryZVertical"
      },
      "depth_scale": 1000.0,
      "depth_unit": "mm_as_uint16",
      "depth_range_m": [
        2.0,
        2.0
      ]
    },
    {
      "capture_index": 5,
      "prompt_label": "back_facade",
      "photo_filename": "photo_05.jpg",
      "depth_filename": "depth_05.png",
      "timestamp": "2026-05-28T14:32:15.000Z",
      "gps": {
        "latitude": 40.8080015,
        "longitude": -96.7059985,
        "altitude_m": 360.075,
        "horizontal_accuracy_m": 4.0,
        "vertical_accuracy_m": 6.0
      },
      "camera_pose": {
        "intrinsics_row_major": [
          80.0,
          0.0,
          50.0,
          0.0,
          80.0,
          50.0,
          0.0,
          0.0,
          1.0
        ],
        "world_to_camera_row_major": [
          -0.7071067811865477,
          0.0,
          -0.7071067811865475,
          -0.6568542494923815,
          0.0,
          1.0,
          0.0,
          1.6,
          0.7071067811865475,
          0.0,
          -0.7071067811865477,
          -1.6568542494923797,
          0.0,
          0.0,
          0.0,
          1.0
        ]
      },
      "attitude": {
        "quaternion_w": -0.38268343,
        "quaternion_x": 0.0,
        "quaternion_y": 0.92387953,
        "quaternion_z": 0.0,
        "reference_frame": "xArbitraryZVertical"
      },
      "depth_scale": 1000.0,
      "depth_unit": "mm_as_uint16",
      "depth_range_m": [
        2.0,
        2.0
      ]
    },
    {
      "capture_index": 6,
      "prompt_label": "back_left_corner",
      "photo_filename": "photo_06.jpg",
      "depth_filename": "depth_06.png",
      "timestamp": "2026-05-28T14:32:16.000Z",
      "gps": {
        "latitude": 40.8080025,
        "longitude": -96.7059975,
        "altitude_m": 360.125,
        "horizontal_accuracy_m": 4.0,
        "vertical_accuracy_m": 6.0
      },
      "camera_pose": {
        "intrinsics_row_major": [
          80.0,
          0.0,
          50.0,
          0.0,
          80.0,
          50.0,
          0.0,
          0.0,
          1.0
        ],
        "world_to_camera_row_major": [
          -1.8369701987210297e-16,
          0.0,
          -1.0,
          4.999999999999998,
          0.0,
          1.0,
          0.0,
          1.6,
          1.0,
          0.0,
          -1.8369701987210297e-16,
          -4.0,
          0.0,
          0.0,
          0.0,
          1.0
        ]
      },
      "attitude": {
        "quaternion_w": -0.70710678,
        "quaternion_x": 0.0,
        "quaternion_y": 0.70710678,
        "quaternion_z": 0.0,
        "reference_frame": "xArbitraryZVertical"
      },
      "depth_scale": 1000.0,
      "depth_unit": "mm_as_uint16",
      "depth_range_m": [
        2.0,
        2.0
      ]
    },
    {
      "capture_index": 7,
      "prompt_label": "left_facade",
      "photo_filename": "photo_07.jpg",
      "depth_filename": "depth_07.png",
      "timestamp": "2026-05-28T14:32:17.000Z",
      "gps": {
        "latitude": 40.8080035,
        "longitude": -96.7059965,
        "altitude_m": 360.175,